Assets/Robot gripper-bom-5.csv

Name,Purpose,Quantity,Total Cost (USD),Link,Distributor
"SUNLU PLA 3D Printer Filament PLA Filament 1.75mm, Neatly Wound 3D Printing Filament 1.75mm, Dimensional Accuracy +/- 0.02 mm, Fit Most FDM 3D Printers, 1kg Spool (2.2lbs), Black","PLA filament will be used to 3D print all custom components for the project, including the base, gripper arms, linkage system, and servo housing. Based on the overall design and estimated material usage, approximately 1 kg of filament is required to manufacture all parts.",1,13.99,"https://www.amazon.com/gp/product/B07XG3RM58/ref=ox_sc_act_title_1?smid=A2QQRBEFB1LPGH&th=1","Amazon"
"California JOS 1 PCS Breadboard 830 Point Solderless Prototype PCB Board Kit for Arduino Proto Shield Distribution Connecting Blocks","This breadboard will be used for prototyping and organizing electrical connections for the controller.",1,4.59,"https://www.amazon.com/gp/product/B0BRQX6G3T/ref=ox_sc_act_title_6?smid=A2XLLJ8HYD6SMA&th=1","Amazon"
"VWEICYY 2PACK 4 AA Battery Holder housing with Leads,2PCS 4 x 1.5V AA Battery Holder Case, Without Cover	","The battery holder will be used to provide stable  power to the SG90 servo to work properly.	",1,5.99,"https://www.amazon.com/gp/product/B0DZX39MHK/ref=ox_sc_act_title_3?smid=AQ37Z5F5L6GWK&psc=1","Amazon"
"Seeed Studio XIAO RP2040 (Pre-Soldered)	","This microcontroller will control the movement of the gripper.",1,10.99,"https://www.amazon.com/gp/product/B0DRNTQ338/ref=ox_sc_act_title_4?smid=A1YP59NGBNBZUR&psc=1","Amazon"
"WWZMDiB SG90 Micro Servo Motor for Arduino Raspberry Pi DIY (3 Pcs)	","The SG90 servo will actuate the gripper mechanism by converting control signals into motion.",1,6.99,"https://www.amazon.com/gp/product/B0BKPL2Y21/ref=ox_sc_act_title_4?smid=A1YZW40LYQY3L1&psc=1","Amazon"
"California JOS 40 PCS 20 CM (8 inch) Breadboard Jumper Wires Length Optional Dupont Wire Assorted Kit Female to Male Multicolored Ribbon Cables	","The jumper wires will connect the controller to the servo (signal) and provide shared ground while the battery pack powers the servo.",1,3.99,"https://www.amazon.com/gp/product/B0BRTHR2RL/ref=ox_sc_act_title_1?smid=A2XLLJ8HYD6SMA&psc=1","Amazon"
"351pcs 304 Stainless Steel Cross Recessed Machine Screw Bolts Nut Washer Assortment Kit - (M3/M4/M5) 8 Sizes for Mechanical Assembly, DIY Projects, Electronics Repair.	","These screws, nuts, and washers will be used to assemble and securely fasten the 3D printed parts and joints.",1,6.29,"https://www.amazon.com/351pcs-Stainless-Recessed-Machine-Assortment/dp/B0FJXMZ831/ref=sr_1_19?crid=VRB77Z2A7ONR&dib=eyJ2IjoiMSJ9.GbAAP5IzNqp48qRNOUry_ak9CybyLoNygjfPAeX7IoE.ue8HHtnaobnOXJkVtqXRsZOhRulLyKkwt9knhGRaAQo&dib_tag=se&keywords=M3+Machine+Screw+Assortment+Kit+%28includes+screws%2C+nuts%2C+washers%29+20mm+10pcs&nsdOptOutParam=true&qid=1775861788&sprefix=m3+machine+screw+assortment+kit+includes+screws%2C+nuts%2C+washers+20mm+10pcs%2Caps%2C164&sr=8-19&xpid=nYAUDjyntecVl","Amazon"

README.md

# Robot-Gripper

Name	Purpose	Quantity	Total Cost (USD)	Link	Distributor
SUNLU PLA 3D Printer Filament PLA Filament 1.75mm, Neatly Wound 3D Printing Filament 1.75mm, Dimensional Accuracy +/- 0.02 mm, Fit Most FDM 3D Printers, 1kg Spool (2.2lbs), Black	PLA filament will be used to 3D print all custom components for the project, including the base, gripper arms, linkage system, and servo housing. Based on the overall design and estimated material usage, approximately 1 kg of filament is required to manufacture all parts.	1	13.99	https://www.amazon.com/gp/product/B07XG3RM58/ref=ox_sc_act_title_1?smid=A2QQRBEFB1LPGH&th=1	Amazon
California JOS 1 PCS Breadboard 830 Point Solderless Prototype PCB Board Kit for Arduino Proto Shield Distribution Connecting Blocks	This breadboard will be used for prototyping and organizing electrical connections for the controller.	1	4.59	https://www.amazon.com/gp/product/B0BRQX6G3T/ref=ox_sc_act_title_6?smid=A2XLLJ8HYD6SMA&th=1	Amazon
VWEICYY 2PACK 4 AA Battery Holder housing with Leads,2PCS 4 x 1.5V AA Battery Holder Case, Without Cover	The battery holder will be used to provide stable  power to the SG90 servo to work properly.	1	5.99	https://www.amazon.com/gp/product/B0DZX39MHK/ref=ox_sc_act_title_3?smid=AQ37Z5F5L6GWK&psc=1	Amazon
Seeed Studio XIAO RP2040 (Pre-Soldered)	This microcontroller will control the movement of the gripper.	1	10.99	https://www.amazon.com/gp/product/B0DRNTQ338/ref=ox_sc_act_title_4?smid=A1YP59NGBNBZUR&psc=1	Amazon
WWZMDiB SG90 Micro Servo Motor for Arduino Raspberry Pi DIY (3 Pcs)	The SG90 servo will actuate the gripper mechanism by converting control signals into motion.	1	6.99	https://www.amazon.com/gp/product/B0BKPL2Y21/ref=ox_sc_act_title_4?smid=A1YZW40LYQY3L1&psc=1	Amazon
California JOS 40 PCS 20 CM (8 inch) Breadboard Jumper Wires Length Optional Dupont Wire Assorted Kit Female to Male Multicolored Ribbon Cables	The jumper wires will connect the controller to the servo (signal) and provide shared ground while the battery pack powers the servo.	1	3.99	https://www.amazon.com/gp/product/B0BRTHR2RL/ref=ox_sc_act_title_1?smid=A2XLLJ8HYD6SMA&psc=1	Amazon
351pcs 304 Stainless Steel Cross Recessed Machine Screw Bolts Nut Washer Assortment Kit - (M3/M4/M5) 8 Sizes for Mechanical Assembly, DIY Projects, Electronics Repair.	These screws, nuts, and washers will be used to assemble and securely fasten the 3D printed parts and joints.	1	6.29	https://www.amazon.com/351pcs-Stainless-Recessed-Machine-Assortment/dp/B0FJXMZ831/ref=sr_1_19?crid=VRB77Z2A7ONR&dib=eyJ2IjoiMSJ9.GbAAP5IzNqp48qRNOUry_ak9CybyLoNygjfPAeX7IoE.ue8HHtnaobnOXJkVtqXRsZOhRulLyKkwt9knhGRaAQo&dib_tag=se&keywords=M3+Machine+Screw+Assortment+Kit+%28includes+screws%2C+nuts%2C+washers%29+20mm+10pcs&nsdOptOutParam=true&qid=1775861788&sprefix=m3+machine+screw+assortment+kit+includes+screws%2C+nuts%2C+washers+20mm+10pcs%2Caps%2C164&sr=8-19&xpid=nYAUDjyntecVl	Amazon